### ISSUE TITLE
statsd proxy trying to send data to the dead instance of statsd

### ISSUE THREAD

**Issue by jack-walters** [statsd/statsd#664]
**proxyConfig.js** on **statsd-proxy** instance:

```
{
nodes: [
{host: 'statsd-c1-2', port: 8125, adminport: 8126},
{host: 'statsd-c1-1', port: 8125, adminport: 8126}
],
server: './servers/udp',
host:  '0.0.0.0',
port: 8125,
mgmt_port: 8126,
forkCount: 4,
checkInterval: 1000,
cacheSize: 10000
}
```
**config.js** on **statsd-c1-1** instance:
```
{  graphitePort: 2013
, graphiteHost: "graphite-c1-ha"
, port: 8125
, backends: [ "./backends/graphite" ]
, percentThreshold: 95
, deleteIdleStats: true
, debug: true
, dumpMessages: true
, deleteGauges: true
}

```

If one of statsd instances goes down (statsd-c1-1 for example), statsd-proxy instance still trying to send some metrics to the dead host (i watched it in tcpdump of statsd-proxy and observed the absence of sent metrics in the STDOUT of working statsd instance - statsd-c1-2).

**Comment by WoZ** [comment]
@jack-walters may you attach tcpdump log with some explanations like time of shutting down of statsd-c1-1?

**Comment by jack-walters** [comment]
After host **statsd-c1-1** goes down, **statsd-proxy** says about healthcheck error:
5 Mar 13:52:06 - ERROR: [6312] Error during healthcheck on node statsd-c1-1:8125 with EHOSTUNREACH

At this time we can see next traffic on the **statsd-proxy** instance:
- **statsd-proxy** still tries to send metric by upd proto to the dead **statsd-c1-1** instance:
```
13:52:05.797438 IP statsd-proxy-c1-1.51166 > statsd-c1-1.8125: UDP, length 16
13:52:05.797643 IP statsd-proxy-c1-1.51166 > statsd-c1-1.8125: UDP, length 16
13:52:06.801315 IP statsd-proxy-c1-1.42407 > statsd-c1-1.8125: UDP, length 16
13:52:06.801395 IP statsd-proxy-c1-1.51166 > statsd-c1-1.8125: UDP, length 16
13:52:07.831378 IP statsd-proxy-c1-1.39884 > statsd-c1-1.8125: UDP, length 16
13:52:08.836362 IP statsd-proxy-c1-1.39884 > statsd-c1-1.8125: UDP, length 16
```
- at first tcp session in log bellow all fine, after **statsd-c1-1** dies at 13:52:03.507188, **statsd-proxy-c1-1** still tries to connect to mgmt port of **statsd-c1-1**. Port unreachable, but statsd-proxy doesn't remove **statsd-c1-1** instance from ring. 
 
```
13:52:03.276743 IP statsd-proxy-c1-1.33046 > statsd-c1-1.8126: Flags [.], ack 1, win 115, options [nop,nop,TS val 2023243773 ecr 2023243773], length 0
13:52:03.276965 IP statsd-proxy-c1-1.33046 > statsd-c1-1.8126: Flags [P.], seq 1:9, ack 1, win 115, options [nop,nop,TS val 2023243773 ecr 2023243773], length 8
13:52:03.276992 IP statsd-c1-1.8126 > statsd-proxy-c1-1.33046: Flags [.], ack 9, win 114, options [nop,nop,TS val 2023243773 ecr 2023243773], length 0
13:52:03.277134 IP statsd-c1-1.8126 > statsd-proxy-c1-1.33046: Flags [P.], seq 1:12, ack 9, win 114, options [nop,nop,TS val 2023243773 ecr 2023243773], length 11
13:52:03.277171 IP statsd-proxy-c1-1.33046 > statsd-c1-1.8126: Flags [.], ack 12, win 115, options [nop,nop,TS val 2023243773 ecr 2023243773], length 0
13:52:03.277335 IP statsd-proxy-c1-1.33046 > statsd-c1-1.8126: Flags [F.], seq 9, ack 12, win 115, options [nop,nop,TS val 2023243774 ecr 2023243773], length 0
13:52:03.277441 IP statsd-c1-1.8126 > statsd-proxy-c1-1.33046: Flags [F.], seq 12, ack 10, win 114, options [nop,nop,TS val 2023243774 ecr 2023243774], length 0
13:52:03.277471 IP statsd-proxy-c1-1.33046 > statsd-c1-1.8126: Flags [.], ack 13, win 115, options [nop,nop,TS val 2023243774 ecr 2023243774], length 0
13:52:03.507188 IP statsd-proxy-c1-1.33056 > statsd-c1-1.8126: Flags [S], seq 3725913717, win 14600, options [mss 1460,sackOK,TS val 2023244004 ecr 0,nop,wscale 7], length 0
13:52:03.795584 IP statsd-proxy-c1-1.33090 > statsd-c1-1.8126: Flags [S], seq 1305876826, win 14600, options [mss 1460,sackOK,TS val 2023244292 ecr 0,nop,wscale 7], length 0
13:52:04.067773 IP statsd-proxy-c1-1.33126 > statsd-c1-1.8126: Flags [S], seq 3344153234, win 14600, options [mss 1460,sackOK,TS val 2023244564 ecr 0,nop,wscale 7], length 0
13:52:04.277080 IP statsd-proxy-c1-1.33140 > statsd-c1-1.8126: Flags [S], seq 3891252683, win 14600, options [mss 1460,sackOK,TS val 2023244773 ecr 0,nop,wscale 7], length 0
13:52:04.507399 IP statsd-proxy-c1-1.33056 > statsd-c1-1.8126: Flags [S], seq 3725913717, win 14600, options [mss 1460,sackOK,TS val 2023245004 ecr 0,nop,wscale 7], length 0
13:52:04.508558 IP statsd-proxy-c1-1.33162 > statsd-c1-1.8126: Flags [S], seq 1207588538, win 14600, options [mss 1460,sackOK,TS val 2023245005 ecr 0,nop,wscale 7], length 0
13:52:04.795390 IP statsd-proxy-c1-1.33188 > statsd-c1-1.8126: Flags [S], seq 3537640776, win 14600, options [mss 1460,sackOK,TS val 2023245292 ecr 0,nop,wscale 7], length 0
13:52:04.796107 IP statsd-proxy-c1-1.33090 > statsd-c1-1.8126: Flags [S], seq 1305876826, win 14600, options [mss 1460,sackOK,TS val 2023245293 ecr 0,nop,wscale 7], length 0
13:52:05.067994 IP statsd-proxy-c1-1.33228 > statsd-c1-1.8126: Flags [S], seq 1259718549, win 14600, options [mss 1460,sackOK,TS val 2023245564 ecr 0,nop,wscale 7], length 0
13:52:05.068117 IP statsd-proxy-c1-1.33126 > statsd-c1-1.8126: Flags [S], seq 3344153234, win 14600, options [mss 1460,sackOK,TS val 2023245565 ecr 0,nop,wscale 7], length 0
13:52:05.796128 IP statsd-proxy-c1-1.33282 > statsd-c1-1.8126: Flags [S], seq 2344520208, win 14600, options [mss 1460,sackOK,TS val 2023246293 ecr 0,nop,wscale 7], length 0
13:52:06.797123 IP statsd-proxy-c1-1.33090 > statsd-c1-1.8126: Flags [S], seq 1305876826, win 14600, options [mss 1460,sackOK,TS val 2023247294 ecr 0,nop,wscale 7], length 0
```

**Comment by WoZ** [comment]
Added #665, so merge and check it, please.

**Comment by jack-walters** [comment]
@WoZ thanks for fix
https://github.com/statsd/statsd/pull/665#issuecomment-471514533
